Permit,Site / Facility,City,Owner / Operator,Date Issued,Primary SIC/NAICS code,Seconday SIC/NAICS code,GPS Latitude,GPS Longitude,Facility Physical Address,Facility Physical Description,Borough (or similar governemtn subdivision),Phone number,email address
AKR06AC57,Crowley Fuels LLC Valdez Facility,Valdez,Crowley Fuels,17-Jun-20,,,,,,,,,
AKR06AD95,Trident Seafoods Ketchikan Facility,Ketchikan,Trident Seafoods,16-Jun-20,,,,,,,,,
AKR06AB42,Haines Gravel Rock Source,Haines,Secon,16-Jun-20,,,,,,,,,
AKR06AA61,Northwest Auto Parts_1,Anchorage,Northwest Auto Parts,16-Jun-20,,,,,,,,,
AKR06AA51,Frosty Fuels Cold Bay Bulk Fuel Facility,Cold Bay,Aleut Enterprise LLC,15-Jun-20,,,,,,,,,
AKR06GB09,Skookum Quarry,Chugiak,Western Construction &amp; Equipment,12-Jun-20,,,,,,,,,
AKR06AE82,Silver Bay Seafoods- Sitka,Sitka,Silver Bay Seafoods,12-Jun-20,,,,,,,,,
AKR06AA03,Adak Petroleum LLC Bulk Fuel Facility,Adak,Aleut Enterprise LLC dba Adak Petroleum ,12-Jun-20,,,,,,,,,
AKR06AB30,Claire Air LLC,Fairbanks,"Tatonduk Outfitters Limited, EAC/EAA ",11-Jun-20,,,,,,,,,
AKR06AB19,Gilmore,Fairbanks,"Fairbanks Gold Mining, Inc.",11-Jun-20,,,,,,,,,
AKR06AB39,APMA 9156-Gil Exploration Site,Fairbanks,"Fairbanks Gold Mining, Inc.",11-Jun-20,,,,,,,,,
AKR06GB04,Metco Alaska LLC,Seward,Metco Alaska LLC,10-Jun-20,,,,,,,,,
AKR06AB45,Hidden Valley Quarry,Juneau,Secon,10-Jun-20,,,,,,,,,
AKR06GB06,Granite Construction RV Park Quarry,Girdwood,Granite Construction Company,9-Jun-20,,,,,,,,,
AKR06AE51,Trident Seafoods Akutan Facility,Akutan,Trident Seafoods,9-Jun-20,,,,,,,,,
AKR06AF61,Southeast Stevedoring Marine Service Center,Ketchikan,Sotheast Stevedoring Corporation,9-Jun-20,,,,,,,,,
AKR06GA40,Noatak River Gravel Mine-Nimiuk Pt Gravel Mine,Kotzebue,Drake Construction Inc,9-Jun-20,,,,,,,,,
AKR06AF88,Sysco Alaska Inc,Anchorage,"Sysco Alaska, Inc.",8-Jun-20,,,,,,,,,
AKR06AF64,Trident Seafoods Cordova South MSGP,Cordova,Trident Seafoods,5-Jun-20,,,,,,,,,
AKR06AA04,Shoreside Petroleum Inc. Seward Bulk Fuel Facility and Marin,Seward,Shoreside Petroleum Inc.,4-Jun-20,,,,,,,,,
AKR06AA89,Aggpro Site,Juneau,SECON,4-Jun-20,,,,,,,,,
AKR06AF94,Sound Quarry Inc,Nome,Sound Quarry Inc.,3-Jun-20,,,,,,,,,
AKR06GA99,Lookout Cove LTF MSGP,Kodiak,Hornby Alaska Timber Inc.,3-Jun-20,,,,,,,,,
AKR06AA62,Whittier Terminal,Whittier,"Shoreside Petroleum, Inc.",3-Jun-20,,,,,,,,,
AKR06AF48,Trident Seafoods Petersburg-MSGP,Petersburg,Trident Seafoods,1-Jun-20,,,,,,,,,
AKR06GA10,Silver Bay Seafoods False Pass MSGP,False Pass,Silver Bay Seafoods,1-Jun-20,,,,,,,,,
AKR06AD73,"Silver Bay Seafoods, Valdez",Valdez,Silver Bay Seafoods- Valdez,27-May-20,,,,,,,,,
AKR06AE37,Trident Seafoods Cordova North Facility,Cordova,Trident Seafoods,27-May-20,,,,,,,,,
AKR06AC56,Nome Tank  Farm,Nome,Crowley Fuels LLC,26-May-20,,,,,,,,,
AKR06AB80,KoKo North,Fairbanks,Everts Air Fuel,22-May-20,,,,,,,,,
AKR06AC58,Pogo Mine MSGP,Fairbanks,Northern Star (Pogo) LLC,21-May-20,,,,,,,,,
AKR06AD61,North Lemon Creek Material Source,Juneau,City and Borough of Juneau,21-May-20,,,,,,,,,
AKR06AD60,South Lemon Creek Material Source,Juneau,City and Borough of Juneau,21-May-20,,,,,,,,,
AKR06AC70,Stabler Point Rock Quarry,Juneau,City and Borough of Juneau,21-May-20,,,,,,,,,
AKR06AA85,Seward Rock Quarry,Seward,Kenai Peninsula Borough,21-May-20,,,,,,,,,
AKR06AF32,Silver Bay Seafoods - Naknek,Naknek,Silver Bay Seafoods,21-May-20,,,,,,,,,
AKR06AE33,Fort Wainwright Central Heat and Power Plant CHPP,Fort Wainwright,"Doyon Utilities, LLC",20-May-20,,,,,,,,,
AKR06AE20,Bethel Airport Delta Western Operations,Bethel,"Delta Western, LLC",20-May-20,,,,,,,,,
AKR06AC55,Kotzebue Tank Farm,Kotzebue,Crowley Fuels LLC,18-May-20,,,,,,,,,
AKR06AC25,USCG Air Station Sitka,Sitka,USCG,15-May-20,,,,,,,,,
AKR06AA20,Homer Harbor Marine Repair Facility,Homer,City of Homer Port and Harbor,14-May-20,,,,,,,,,
AKR06AA82,Lang Street Facility,Anchorage,Granite Construction Company,13-May-20,,,,,,,,,
AKR06AA18,Bryant Army Aviation Support Facility,JBER,Alaska Army National Guard,13-May-20,,,,,,,,,
AKR06AB16,QAP C Street Facility,Anchorage,QAP,13-May-20,,,,,,,,,
AKR06GA96,Delta Western LLC-Unalaska-Dutch Harbor Airport,Dutch Harbor,"Delta Western, LLC",13-May-20,,,,,,,,,
AKR06AA79,Snug Harbor Road Material Site,Cooper Landing,Kenai Peninsula Borough,13-May-20,,,,,,,,,
AKR06AF77,International Seafoods of Alaska,Kodiak,SILVER BAY SEAFOODS,12-May-20,,,,,,,,,
AKR06AB17,Fort Knox Mine Fairbanks,Fairbanks,"Fairbanks Gold Mining, Inc.",11-May-20,,,,,,,,,
AKR06AE63,Nikiski Terminal,Kenai,Tesoro Alaska Company LLC,8-May-20,,,,,,,,,
AKR06AD01,Kenai Pipe Line Facility,Kenai,Tesoro Alaska Company LLC,8-May-20,,,,,,,,,
AKR06AE25,Trident Kodiak-SOK,Kodiak,Trident Seafoods,8-May-20,,,,,,,,,
AKR06AD09,Klondike Concrete,Chugiak,Klondike Concrete,6-May-20,,,,,,,,,
AKR06AE87,Trident Seafoods Wrangell Facility,Wrangell,Trident Seafoods,6-May-20,,,,,,,,,
AKR06GA65,Kodiak Fishmeal Company MSPG,Kodiak,Kodiak Fishmeal Company,6-May-20,,,,,,,,,
AKR06AA24,Port of Cordova Shipyard Facility,Cordova,City of Cordova,5-May-20,,,,,,,,,
AKR06AC02,Agrium Kenai Nitrogen Operations,Kenai,Agrium Kenai Nitrogen Operations,1-May-20,,,,,,,,,
AKR06AF42,Alaska Aerofuel Inc.,Fairbanks,Alaska Aerofuel Inc.,1-May-20,,,,,,,,,
AKR06GA93,Peak Gold Project,Tok,"Peak Gold, LLc.",1-May-20,,,,,,,,,
AKR06AB73,KRM Quarry,Ketchikan,SECON,1-May-20,,,,,,,,,
AKR06AF55,Trident Seafoods Kodiak Pillar Mountain - KPM,Kodiak,Trident Seafoods,30-Apr-20,,,,,,,,,
AKR06AA94,Ketchikan International Airport,Ketchikan,Ketchikan International Airport,21-Apr-20,,,,,,,,,
AKR06AA26,Ugadaga Quarry,Unalaska,Northern Alaska Contractors,17-Apr-20,,,,,,,,,
AKR06AB33,Calder Mine,Calder           ,Columbia River Carbonates,17-Apr-20,,,,,,,,,
AKR06GA67,Ward Cove Facility-Delta Western,Anchorage,"Delta Western, LLC",10-Mar-20,,,,,,,,,
AKR06GA59,Sockeye Point,Seward,Sockeye Point Marine Services LLC,21-Feb-20,,,,,,,,,
AKR06GA54,Delta Western Juneau-Auke Bay Dock Fixed Facility,Juneau,"Delta Western, LLC",22-Jan-20,,,,,,,,,
AKR06GA43,Petro Star Fairbanks Rail and Truck Terminal,FAIRBANKS,Petro Star Inc,28-Oct-19,,,,,,,,,
AKR06GA41,Trident St Paul MSGP,Saint Paul,Trident Seafoods,3-Oct-19,,,,,,,,,
AKR06GA38,Trident Seafoods Chignik Support Facility,Chignik,Trident Seafoods,3-Oct-19,,,,,,,,,
AKR06GA37,Trident Seafoods Chignik Production Facility,Chignik,Trident Seafoods,3-Oct-19,,,,,,,,,
AKR06GA30,False Pass Fueling Services LLC,False Pass,Trident Seafoods,16-Sep-19,,,,,,,,,
AKR06GA29,False Pass Seafoods LLC,False Pass,Trident Seafoods,16-Sep-19,,,,,,,,,
AKR06GA26,Sterling Cement WP,Sterling,Halliburton Energy Services Inc.,4-Sep-19,,,,,,,,,
AKR06GA25,Fairbanks Bulk Cement Plant,Fairbanks,Halliburton Energy Services,4-Sep-19,,,,,,,,,
AKR06GA24,Baroid Mud Plt,Deadhorse,Halliburton Energy Services,4-Sep-19,,,,,,,,,
AKR06GA23,Halliburton North Slope Prudhoe Field Camp,Deadhorse,"Halliburton Energy Services, Inc",4-Sep-19,,,,,,,,,
AKR06GA22,Colville Transport-Van Horn Fuel Transfer Facility,Fairbanks,Colville Inc,23-Aug-19,,,,,,,,,
AKR06GA17,MPC North Pole Terminal Facility,North Pole,MPC Alaska Terminal Company LLC,1-Aug-19,,,,,,,,,
AKR06GA16,Alaska Stormwater Maintenance Yard,Anchorage,Alaska Stormwater Maintenance,17-Jul-19,,,,,,,,,
AKR06GA14,Salcha Canaday Homestead C&amp;D Monofill,Salcha,Central Recycling Services,3-Jul-19,,,,,,,,,
AKR06GA08,American President Lines Buskin Yard,Kodiak,"American President Lines, LLC",5-Jun-19,,,,,,,,,
AKR06GA03,Alaska Waste Juneau Facility,Juneau,Alaska Waste,21-May-19,,,,,,,,,
AKR06GA01,Alaska Waste Sitka Facility,Sitka,Alaska Waste,21-May-19,,,,,,,,,
AKR06GA04,Curry Quarry_3,Talkeetna,"Alaska Industrial, LLC",9-May-19,,,,,,,,,
AKR06AF98,Cameron,Anchorage,Cameron International Corporation,1-May-19,,,,,,,,,
AKR06GA00,Upper Kalskag Operations,Kalskag,"Knik Construction Co, Inc",24-Apr-19,,,,,,,,,
AKR06AF93,Platinum Operations,Platinum,Knik Construction,20-Mar-19,,,,,,,,,
AKR06AF90,Alaska Central Express,Anchorage,ACE Air Cargo,7-Feb-19,,,,,,,,,
AKR06AF87,Trident Seafoods North Naknek,Naknek,Trident Seafoods,2-Jan-19,,,,,,,,,
AKR06AF84,Anarraaq and Aktigiruq Exploration Access Road,Kivalina,Teck American Incorporated,17-Dec-18,,,,,,,,,
AKR06AF79,"Peak Oilfield Service Company, LLC - Valdez",Valdez,Peak Oilfield Service Company,11-Dec-18,,,,,,,,,
AKR06AF81,Shaw Creek,Delta Junction,Carpenter Contracting Inc,10-Dec-18,,,,,,,,,
AKR06AF80,Aurora Energy - MSGP,Fairbanks,Aurora Energy,3-Dec-18,,,,,,,,,
AKR06AF70,Granite Creek Rock Quarry Reconfigured Lease Lot 4,Sitka,"K &amp; E Alaska, Inc",7-Nov-18,,,,,,,,,
AKR06AF72,Halibut Point Marine Services,"Sitka, ",Halibut Point Marine Services,17-Sep-18,,,,,,,,,
AKR06AF65,Dot Island Ship Moorage and LSA,Ketchikan,"Sealaska Timber Company, LLC",24-Aug-18,,,,,,,,,
AKR06AF53,Summit ESP LLC,Kenai,"Summit ESP, LLC",30-May-18,,,,,,,,,
AKR06AF49,Unalaska Landfill,Unalaska,"City of Unlaska, Dept of Public Utilties",30-May-18,,,,,,,,,
AKR06AF52,Houston Sand and Gravel,Houston,Houston Sand and Gravel,23-May-18,,,,,,,,,
AKR06AF51,JAG Alaska Seward Facility,Seward,"JAG Alaska, Inc.",22-May-18,,,,,,,,,
AKR06AF45,True North Gravel Pit,Fairbanks,"True North Constructors, Inc",9-May-18,,,,,,,,,
AKR06AF39,Port MacKenzie Log Transfer Facility,Big Lake,Denali Timber Management,30-Apr-18,,,,,,,,,
AKR06AF43,Valdez Small Boat Harbor,Valdez,City of Valdez,25-Apr-18,,,,,,,,,
AKR06AF36,TOTE Maritime Alaska,Anchorage,TOTE Maritime Alaska,24-Apr-18,,,,,,,,,
AKR06AF44,Petro Star Inc PoA Terminal,Anchorage,Petro Star Inc.,18-Apr-18,,,,,,,,,
AKR06AF41,Off-Airport Fuel Facility,Anchorage,Menzies Aviation,2-Apr-18,,,,,,,,,
AKR06AF34,Great Circle Flight Service LLC,Anchorage,ANC AK Holdidngs LLC,12-Mar-18,,,,,,,,,
AKR06AF24,Alaska Marine Trucking Y1 Yard,Anchorage,Alaska Marine Trucking,12-Feb-18,,,,,,,,,
AKR06AF27,Tesoro Fairbanks Petroleum Terminal,Fairbanks,"Tesoro Logistics Operations, LLC",7-Feb-18,,,,,,,,,
AKR06AF18,Usibelli Coal Mine- Rosalie Mine,Healy,Usibelli Coal Mine,18-Jan-18,,,,,,,,,
AKR06AF21,Exit Marine LLC,Seward,Exit Marine LLC,2-Jan-18,,,,,,,,,
AKR06AF12,Nov Tuboscope Nikiski,Nikiski,National Oilwell Varco,30-Oct-17,,,,,,,,,
AKR06AE94,Metco Alaska LLC,Seward,Metco Inc,10-Aug-17,,,,,,,,,
AKR06AE81,Purinton Products- West Susitna Pit,Big Lake,Purinton Products LLC,21-Jul-17,,,,,,,,,
AKR06AE88,Snake Lake Quarry,Dillingham,"Bristol Construction Services, LLC",18-Jul-17,,,,,,,,,
AKR06AE89,Trident Seafoods Sand Point Facility,Sand Point,Trident Seafoods,16-Jun-17,,,,,,,,,
AKR06AE68,Unalakleet Airport,Unalakleet,ADOT &amp; PF,13-Jun-17,,,,,,,,,
AKR06AE67,St Marys Airport,Saint Marys,ADOT &amp; PF,8-Jun-17,,,,,,,,,
AKR06AE84,Barrow Fuel Storage Facility,Barrow,"Eskimos, Inc.",11-May-17,,,,,,,,,
AKR06AE83,Silver Bay Seafoods - Craig MSGP,Craig,Silver Bay Seafoods,3-May-17,,,,,,,,,
AKR06AE71,Delta Air Lines Fairbanks Station (FAI),Fairbanks,Delta Global Services- Delta Airlines,31-Mar-17,,,,,,,,,
AKR06AE44,Matson Terminal Dutch Harbor,Dutch Harbor,"Matson Navigtion Company of Alaska, LLC",2-Mar-17,,,,,,,,,
AKR06AE72,Homer Truck Barn &amp; Maintenance Facility,Homer,Petro 49 Inc.,1-Mar-17,,,,,,,,,
AKR06AE62,Safeway,Anchorage,Carrs-Safeway,22-Feb-17,,,,,,,,,
AKR06AE69,Barefoot Beach Log Transfer Facility,Afognak,Koncor Forest Products,14-Feb-17,,,,,,,,,
AKR06AE64,Granite Creek Rock Quarry Lot 5,Sitka,City and Borough of Sitka,24-Jan-17,,,,,,,,,
AKR06AE60,Anchorage Terminal 2,Anchorage,Tesoro Logistics Opeations LLC,9-Nov-16,,,,,,,,,
AKR06AE56,Symth Drive Facility,Anchorage,Knik Construction,31-Oct-16,,,,,,,,,
AKR06AE47,Klehini Sand and Gravel,Haines,"Southeast Roadbuilders, Inc.",20-Sep-16,,,,,,,,,
AKR06AE41,Samson Freight Terminal,Ketchikan,Sampson Tug &amp; Barge,14-Sep-16,,,,,,,,,
AKR06AE40,PenAir King Salmon Facility,King Salmon,"Peninsula Airways, Inc.",14-Sep-16,,,,,,,,,
AKR06AE31,Wasilla Creek Gravel Pit,Palmer,"Neeser Construction, Inc.",17-Aug-16,,,,,,,,,
AKR06AE36,Lower Kalskag,Lower Kalskag,City of Lower Kalskag,16-Aug-16,,,,,,,,,
AKR06AE35,Matson Terminal Anchorage,Anchorage,"Matson Navigation Company of Alaska, LLC",16-Aug-16,,,,,,,,,
AKR06AE30,Sitka CMI Asphalt Plant,Sitka,Colaska dba Secon,27-Jul-16,,,,,,,,,
AKR06AE27,Ocean Dock Terminal,Anchorage,Tesoro Logistics Operations LLC,21-Jul-16,,,,,,,,,
AKR06AE26,Edna Bay Log Transfer Facility,Klawock,Alcan Forest Products LP,21-Jul-16,,,,,,,,,
AKR06AE22,X551 CMI Hot Plant,Juneau,"Miller Construction Co., LTD",11-Jul-16,,,,,,,,,
AKR06AE19,Keete Inlet LTF,Hydaburg,Sealaska Timber Corporation,1-Jul-16,,,,,,,,,
AKR06AE18,McKenzie Inlet LTF,Thorne Bay,Sealaska Timber Corporation,1-Jul-16,,,,,,,,,
AKR06AE24,Quality Sand &amp; Gravel-Morgan,Palmer,Quality Sand &amp; Gravel,1-Jul-16,,,,,,,,,
AKR06AE21,Yakutat Airport- Delta Western Operations,Yakutat,"Delta Western, LLC",14-Jun-16,,,,,,,,,
AKR06AD97,Juneau International Airport-Aero,Juneau,Aero Services,3-Jun-16,,,,,,,,,
AKR06AE09,Ten Mile Sub 2 Tract C,Anchor Point,"Boondocks, LLC",23-May-16,,,,,,,,,
AKR06AE04,North Side Business Park Peat and Topsoil Operations,Fairbanks,Perrizo Enterprises,7-Apr-16,,,,,,,,,
AKR06AE05,North Side Business Park Peat and Topsoil Operations_2,Fairbanks,"North Side Development, LP",7-Apr-16,,,,,,,,,
AKR06AE00,Kingsberry Material Site,Nome,Innovation Mining,23-Mar-16,,,,,,,,,
AKR06AD92,Bering Air,Nome,Bering Air Inc,22-Feb-16,,,,,,,,,
AKR06AD93,Bering Air Kotzebue,Kotzebue,Bering Air Inc,22-Feb-16,,,,,,,,,
AKR06AD85,Nicks Auto Wrecking Salvage and Metal Recycling_2,Kodiak,Nicks Auto Wrecking Salvage and Metal Re,25-Jan-16,,,,,,,,,
AKR06AD65,Nixon Fork Mine MSGP,McGrath,Mystery Creek Resources Inc.,20-Jan-16,,,,,,,,,
AKR06AD87,North Park Fuels,Anchorage,North Park Fuels,19-Jan-16,,,,,,,,,
AKR06AD83,Akutan Boat Harbor_2,Akutan,City of Akutan,14-Jan-16,,,,,,,,,
AKR06AD80,"West Glacier Development, LLC",Juneau,"West Glacier Development, LLC",14-Dec-15,,,,,,,,,
AKR06AD79,"Quality Sand &amp; Gravel, LLC",Palmer,"Quality Sand &amp; Gravel, LLC",14-Dec-15,,,,,,,,,
AKR06AD78,Signature Flight Support Corp,Anchorage,Signature Flight Support Corp.,10-Dec-15,,,,,,,,,
AKR06AD71,Sitka Ready-Mix Rental Equipment,Sitka,"Sitka Ready-Mix Rental Equipment, LLC",2-Dec-15,,,,,,,,,
AKR06AD81,Airport Pit,Hoonah,Cascade Sand and Gravel,1-Dec-15,,,,,,,,,
AKR06AD68,Foster Construction,Kenai,"Foster Construction, Inc.",30-Nov-15,,,,,,,,,
AKR06AD66,D &amp; S Concrete Inc,Anchorage,D &amp; S Concrete Inc.,30-Nov-15,,,,,,,,,
AKR06AD64,Dillingham Quarry,Dillingham,"Knik Construction Co., Inc",25-Nov-15,,,,,,,,,
AKR06AD63,Juneau International Airport_Alaska Seaplanes,Juneau,Alaska Seaplanes,24-Nov-15,,,,,,,,,
AKR06AD57,PenAir Hangar and L1 Gate Ramp at ANC Intl Airport,Anchorage,"Peninsula Airways, Inc., dba PenAir",18-Nov-15,,,,,,,,,
AKR06AD54,Burkeshore Marina_1,Big Lake,"Burkeshore Marina Enterprises, LLC",18-Nov-15,,,,,,,,,
AKR06AD53,Wrangell Marine Service Center,Wrangell,City of Wrangell,4-Nov-15,,,,,,,,,
AKR06AD51,Hoonah Marine Industrial Center MSGP,Hoonah,City of Hoonah,2-Nov-15,,,,,,,,,
AKR06AD47,Deadhorse Aviation Center,Deadhorse,"Deadhorse Aviation Center, LLC",29-Oct-15,,,,,,,,,
AKR06AD36,S&amp;S Aggregate,Haines,S&amp;S Aggregate,27-Oct-15,,,,,,,,,
AKR06AD29,Brown Anchor Point Material Site,Anchor Point,Brown Construction Company Inc,20-Oct-15,,,,,,,,,
AKR06AD42,Juneau International Airport,Juneau,"City and Borough of Juneau, Airport Dept",15-Oct-15,,,,,,,,,
AKR06AD34,City of Seward Rock Quarry_2,Seward,"Hamilton Construction, LLC",14-Oct-15,,,,,,,,,
AKR06AD40,Juneau International Airport_Coastal Fuel Inc.,Juneau,"Coastal Fuel, Inc.",14-Oct-15,,,,,,,,,
AKR06AD25,DSG Cantwell Pit,Cantwell,Denali Sand &amp; Gravel LLC,13-Oct-15,,,,,,,,,
AKR06AD38,ISC Kodiak USCG Installation MSGP,Kodiak,US Coast Guard,8-Oct-15,,,,,,,,,
AKR06AD35,Kenai Municipal Airport MSGP,Kenai,City of Kenai,6-Oct-15,,,,,,,,,
AKR06AD27,"Alaska Scrap and Recycling, LLC",Anchorage,"Alaska Scrap and Recycling, LLC",28-Sep-15,,,,,,,,,
AKR06AD26,Vigor Alaska Ketchikan,Ketchikan,"Vigor Industrial, LLC",28-Sep-15,,,,,,,,,
AKR06AD12,Emulsion Products Viking Facility,Anchorage,Emulsion Products Company,23-Sep-15,,,,,,,,,
AKR06AD21,HC Redi Mix Facility,North Pole,"HC Contractors, Inc.",21-Sep-15,,,,,,,,,
AKR06AD23,Alaska General Seafoods-Naknek Mile 1,Naknek,Alaska General Seafoods,21-Sep-15,,,,,,,,,
AKR06AD24,Alaska General Seafoods -Naknek Mile 1.5,Naknek,Alaska General Seafoods ,21-Sep-15,,,,,,,,,
AKR06AD19,Alaska General Seafoods-Ketchikan,Ketchikan,Alaska General Seafoods-Ketchikan,17-Sep-15,,,,,,,,,
AKR06AD16,Inter-Island Ferry Authority Clark Bay Hollis Terminal,Hollis,Inter-Island Ferry Authority,14-Sep-15,,,,,,,,,
AKR06AD14,Eielson Air Force Base,Eielson AFB,US Air Force,8-Sep-15,,,,,,,,,
AKR06AD13,Kiana East Pit Legacy Material Site,Kiana,NANA Regional Corporation,8-Sep-15,,,,,,,,,
AKR06AD11,Alaska Garden and Pet Supply Inc,Anchorage,"Alaska Garden &amp; Pet Supply, Inc.",8-Sep-15,,,,,,,,,
AKR06AD08,Baker Hughes Anchorage Joint Facility,Anchorage,Baker Hughes Oilfield Operations LLC,26-Aug-15,,,,,,,,,
AKR06AD07,Northern Alaska Tour Company NATC- North K,Fairbanks,Northern Alaska Tour Company,25-Aug-15,,,,,,,,,
AKR06AD06,Northern Alaska Tour Company - South K,Fairbanks,Northern Alaska Tour Company,25-Aug-15,,,,,,,,,
AKR06AD05,"Warbelow&#39;s Air Ventures, Inc.",Fairbanks,"Warbelow&#39;s Air Ventures, Inc.",25-Aug-15,,,,,,,,,
AKR06AD02,Baker Hughes Kenai Upstream Chemicals,Kenai,"Baker Hughes, Inc.",25-Aug-15,,,,,,,,,
AKR06AD00,Capitol Disposal Landfill Inc,Juneau,"Capitol Disposal, Inc.",19-Aug-15,,,,,,,,,
AKR06AC99,"Arrowhead Transfer, Inc.",Sitka,Arrowhead Transfer Inc.,17-Aug-15,,,,,,,,,
AKR06AC98,Auke Bay Loading Facility -Boatyard,Juneau,"Harri Plumbing &amp; Heating, Inc.",17-Aug-15,,,,,,,,,
AKR06AD91,"First Student Inc., #22021",Juneau,"First Student, Inc #22021",17-Aug-15,,,,,,,,,
AKR06AA88,Usibelli Coal Mine,Healy,Usibelli Coal Mine,13-Aug-15,,,,,,,,,
AKR06AC93,Wrangell Airport,Wrangell,Alaska Department of Transportation,13-Aug-15,,,,,,,,,
AKR06AC92,Yakutat Airport,Yakutat,Alaska Department of Transportation,13-Aug-15,,,,,,,,,
AKR06AC91,Unalaska Airport,Dutch Harbor,Alaska Department of Transportation,13-Aug-15,,,,,,,,,
AKR06AC90,Sitka Rocky Gutierrez Airport MSGP,Sitka,Alaska Department of Transportation,13-Aug-15,,,,,,,,,
AKR06AC89,Petersburg James A Johnson Airport,Peterburg,Alaska Department of Transportation,13-Aug-15,,,,,,,,,
AKR06AC88,Kodiak State Airport,Kodiak,Alaska Department of Transportation,13-Aug-15,,,,,,,,,
AKR06AC87,King Salmon Airport,King Salmon,Alaska Department of Transportation,13-Aug-15,,,,,,,,,
AKR06AA98,Alaska Waste Anchorage,Anchorage,"Waste Connections of Alaska, Inc.",12-Aug-15,,,,,,,,,
AKR06AC85,Joint Base Elmendorf-Richardson,JBER,Joint Base Elmendorf-Richardson,11-Aug-15,,,,,,,,,
AKR06AB78,USCG Aviation Support Facility,Cordova,US Coast Guard,11-Aug-15,,,,,,,,,
AKR06AC84,US Army Garrison Fort Greely,Fort Greely,US Army Garrison Fort Greely,11-Aug-15,,,,,,,,,
AKR06AC83,Kodiak Island Borough Landfill,Kodiak,Kodiak Island Borough ,11-Aug-15,,,,,,,,,
AKR06AC77,Alaska Marine Trucking LLC-Maintenance,Juneau,"Alaska Marine Trucking, LLC",7-Aug-15,,,,,,,,,
AKR06AC76,Alaska Marine Trucking LLC-Yard,Juneau,"Alaska Marine Trucking, LLC",7-Aug-15,,,,,,,,,
AKR06AC75,"Alaska Marine Trucking, LLC",Petersburg,"Alaska Marine Trucking, LLC",7-Aug-15,,,,,,,,,
AKR06AC74,Alaska Marine Trucking Ketchikan Facility,Ketchikan,"Alaska Marine Trucking, LLC",7-Aug-15,,,,,,,,,
AKR06AC72,WestRock CP LLC,Anchorage,"RockTenn CP, LLC",7-Aug-15,,,,,,,,,
AKR06AC73,US Army Garrison Fort Wainwright,Fort Wainwright,Fort Wainwright Directorate of Public Wo,7-Aug-15,,,,,,,,,
AKR06AC01,Near Island Pit,Kodiak,"Brechan Enterprises, Inc",7-Aug-15,,,,,,,,,
AKR06AC69,Ted Stevens Anchorage International Airport,Anchorage,State of Alaska Department of Transporta,6-Aug-15,,,,,,,,,
AKR06AC68,Weaver Bros Inc Truck Wash,Anchorage,Weaver Brothers Inc,6-Aug-15,,,,,,,,,
AKR06AC67,Kenai Terminal,Kenai,Weaver Brothers Inc,6-Aug-15,,,,,,,,,
AKR06AC65,Weaver Brothers Incorporated- Anchorage Terminal,Anchorage,"Weaver Bros., Inc.",6-Aug-15,,,,,,,,,
AKR06AB77,BIHA Indian River Quarry,Sitka,Baranof Island Housing Authority,6-Aug-15,,,,,,,,,
AKR06AC63,Merrill Field Airport MOA,Anchorage,Merrill Field Airport-Municipality of An,6-Aug-15,,,,,,,,,
AKR06AC62,Nabors Kenai Yard,Kenai,"Nabors Alaska Drilling, Inc",6-Aug-15,,,,,,,,,
AKR06AC61,Nabors 104th Yard,Anchorage,"Nabors Alaska Drilling, Inc",6-Aug-15,,,,,,,,,
AKR06AC60,"North Star Terminal &amp; Stevedore Company, LLC",Anchorage,"North Star Terminal &amp; Stevedore Co., LLC",6-Aug-15,,,,,,,,,
AKR06AC59,Peat Pit,Fairbanks,Great Northwest Inc,6-Aug-15,,,,,,,,,
AKR06AC71,"Leader Creek Fisheries, Inc.",Naknek,"Leader Creek Fisheries, Inc.",6-Aug-15,,,,,,,,,
AKR06AC54,Juneau Bulk Plant,Juneau,,5-Aug-15,,,,,,,,,
AKR06AC14,Alaska Airlines Bethel Station,Bethel,Alaska Airlines Inc,4-Aug-15,,,,,,,,,
AKR06AC13,Alaska Airlines Barrow Station,Barrow,Alaska Airlines Inc.,4-Aug-15,,,,,,,,,
AKR06AC12,Alaska Airlines Cordova Station,Cordova,Alaska Airlines Inc,4-Aug-15,,,,,,,,,
AKR06AC11,Alaska Airlines Fairbanks Station,Fairbanks,Alaska Airlines Inc,4-Aug-15,,,,,,,,,
AKR06AC10,Alaska Airlines Ketchikan Station,Ketchikan,Alaska Airlines Inc,4-Aug-15,,,,,,,,,
AKR06AC07,Alaska Airlines Juneau Station,Juneau,Alaska Airlines Inc,4-Aug-15,,,,,,,,,
AKR06AC06,Alaska Airlines Nome Station,Nome,Alaska Airlines Inc,4-Aug-15,,,,,,,,,
AKR06AC05,Alaska Airlines Kotzebue Station,Kotzebue,Alaska Airlines Inc,4-Aug-15,,,,,,,,,
AKR06AC04,Alaska Airlines Yakutat Station,Yakutat,Alaska Airlines Inc,4-Aug-15,,,,,,,,,
AKR06AC00,Alaska Airlines Petersburg Station,Petersburg,Alaska Airlines Inc,4-Aug-15,,,,,,,,,
AKR06AB99,Alaska Airlines Prudhoe Bay Station,Prudhoe Bay,Alaska Airlines Inc,4-Aug-15,,,,,,,,,
AKR06AB97,Alaska Airlines Sitka Station,Sitka,Alaska Airlines Inc,4-Aug-15,,,,,,,,,
AKR06AB96,Alaska Airlines Wrangell Station,Wrangell,Alaska Airlines Inc,4-Aug-15,,,,,,,,,
AKR06AC08,City of Kodiak Wastewater Treatment Plant- MSGP,Kodiak,City of Kodiak,4-Aug-15,,,,,,,,,
AKR06AC15,USAF Eareckson Air Station,Shemya Island,Chugach Federal Solutions,4-Aug-15,,,,,,,,,
AKR06AB95,Ralph Wien Memorial Airport Kotzebue AK,Kotzebue,ADOT&amp;PF,4-Aug-15,,,,,,,,,
AKR06AB94,Nome Airport,Nome,ADOT&amp;PF,4-Aug-15,,,,,,,,,
AKR06AB92,Valdez Pioneer Field Airport,Valdez,ADOT&amp;PF,4-Aug-15,,,,,,,,,
AKR06AB91,Merle K Mudhole Smith Airport Cordova AK,Cordova,ADOT&amp;PF,4-Aug-15,,,,,,,,,
AKR06AB89,Deadhorse Airport,Prudhoe Bay,ADOT&amp;PF,4-Aug-15,,,,,,,,,
AKR06AB67,Carlile Aspen Facility,Fairbanks,"Carlile Transportation Systems, Inc.",4-Aug-15,,,,,,,,,
AKR06AB66,Carlile Kenai Facility,Kenai,Carlile Transportation Systems Inc.,4-Aug-15,,,,,,,,,
AKR06AC48,Petersburg Bulk Plant,Petersburg,Petro49 Inc.,4-Aug-15,,,,,,,,,
AKR06AC49,Craig Bulk Plant,Craig,Petro49 Inc.,4-Aug-15,,,,,,,,,
AKR06AC50,Homer Bulk Plant,Homer,Petro49 Inc.,4-Aug-15,,,,,,,,,
AKR06AC51,Juneau Bulk Plant,Juneau,Petro49 Inc.,4-Aug-15,,,,,,,,,
AKR06AC52,Ketchikan Bulk Plant,Ketchikan,Petro49 Inc.,4-Aug-15,,,,,,,,,
AKR06AC16,Alaska Airlines Anchorage Station,Anchorage,Alaska Airlines Inc,4-Aug-15,,,,,,,,,
AKR06AB85,"Wiley Post/Will Rogers Airport, Barrow, AK",Barrow,ADOT&amp;PF,3-Aug-15,,,,,,,,,
AKR06AB84,Bethel Operations Yard,Bethel,"Knik Construction Co., Inc.",3-Aug-15,,,,,,,,,
AKR06AB76,Fairbanks International Airport - DOT&amp;PF,Fairbanks,Fairbanks International Airport-DOT&amp;PF,3-Aug-15,,,,,,,,,
AKR06AB64,Carlile Anchorage Facility,Anchorage,"Carlile Transportation Systems, Inc.",3-Aug-15,,,,,,,,,
AKR06AB71,Klawock Rock,Klawock,"Southeast Road Builders, Inc.",3-Aug-15,,,,,,,,,
AKR06AC38,Ravn-Aniak Airport,Aniak,Ravn Alaska,3-Aug-15,,,,,,,,,
AKR06AC39,Ravn-Deadhorse Airport,Prudhoe Bay,Ravn Alaska,3-Aug-15,,,,,,,,,
AKR06AC40,Ravn Fairbanks,Fairbanks,Ravn Alaska ,3-Aug-15,,,,,,,,,
AKR06AC41,Ravn-Nome Airport,Nome,Ravn Alaska,3-Aug-15,,,,,,,,,
AKR06AC42,Ravn-Galena Airport,Galena,Ravn Alaska,3-Aug-15,,,,,,,,,
AKR06AC43,Ravn-Kotzebue Airport,Kotzebue,Ravn Alaska,3-Aug-15,,,,,,,,,
AKR06AC44,Ravn-St. Mary&#39;s Airport,St. Marys,Ravn Alaska,3-Aug-15,,,,,,,,,
AKR06AB70,Alaska Railroad Corp. Whittier Yard,Whittier,Alaska Railroad Corporation,31-Jul-15,,,,,,,,,
AKR06AB69,Alaska Railroad Corp. Hurricane Section,Cantwell,Alaska Railroad Corporation,31-Jul-15,,,,,,,,,
AKR06AB68,Alaska Railroad Corp. Fairbanks Yard,Fairbanks,Alaska Railroad Corporation,31-Jul-15,,,,,,,,,
AKR06AB65,Anchorage Sand &amp; Gravel - Klatt Rd Facility,Anchorage,Anchorage Sand and Gravel Co Inc,31-Jul-15,,,,,,,,,
AKR06AB57,Kodiak St Herman Harbor Boatlift Facility,Kodiak,City of Kodiak,31-Jul-15,,,,,,,,,
AKR06AC32,Moose Horn Quarry LLC,Chugiak,"Moosehorn Quarry, LLC",31-Jul-15,,,,,,,,,
AKR06AC18,B &amp; R Fish Near Island Quarry,Kodiak,B &amp; R Fish ,31-Jul-15,,,,,,,,,
AKR06AC34,Ravn-Valdez Airport ,Valdez,Ravn Alaska ,31-Jul-15,,,,,,,,,
AKR06AC35,Ravn-Barrow Airport,Barrow,Ravn Alaska,31-Jul-15,,,,,,,,,
AKR06AC36,Ravn-Unalakleet Airport,Unalakleet,Ravn Alaska,31-Jul-15,,,,,,,,,
AKR06AC29,Ravn-Homer Airport,Homer,Ravn Alaska,30-Jul-15,,,,,,,,,
AKR06AC28,Ravn-Kenai Airport,Kenai,Ravn Alaska,30-Jul-15,,,,,,,,,
AKR06AC27,Ravn-Kodiak Airport,Kodiak,Ravn Alaska,30-Jul-15,,,,,,,,,
AKR06AC26,Ravn-Bethel Airport,Bethel,Ravn Alaska,30-Jul-15,,,,,,,,,
AKR06AC23,Livengood Gold Project 2,Livengood,"Tower Hill Mines, Inc.",30-Jul-15,,,,,,,,,
AKR06AC21,UniSea Inc-Dutch Harbor Facility,Dutch Harbor,"UniSea, Inc.",30-Jul-15,,,,,,,,,
AKR06AC20,Nikiski Facility,Nikiski,"Peak Oilfield Services Co, LLC",30-Jul-15,,,,,,,,,
AKR06AB63,"Wright Air Service, Inc.",Fairbanks,"Wright Air Service, Inc.",29-Jul-15,,,,,,,,,
AKR06AB55,Anchorage Section and Yard ARRC,Anchorage,Alaska Railroad Corp.,28-Jul-15,,,,,,,,,
AKR06AB51,Southside Pit,North Pole,Exclusive Paving / University Redi-Mix,28-Jul-15,,,,,,,,,
AKR06AA86,Insulfoam,Anchorage,Insulfoam,27-Jul-15,,,,,,,,,
